{
  "$schema": "https://json-schema.org/draft/2020-12/schema",
  "$id": "https://github.com/rafsanulhasan/ai-dlc-agent-workflow-plugin/auto-handoff.schema.json",
  "title": "AI-DLC automatic session handoff settings",
  "description": "Settings of the ai-dlc plugin's automatic session handoff (Claude Code only), committed in .ai-dlc/auto-handoff.json. Each key is read, highest first, from the env of .claude/settings.local.json (its x-env variable), the env of .claude/settings.json, the process environment, this file, the plugin's /config option (keys that have one), then the default. null means not set here: the next source applies. An invalid value is logged and the next source applies. Keys marked x-trustGated apply from this file only when Claude Code trusts the folder (projects[<repository root>].hasTrustDialogAccepted in ~/.claude.json); elsewhere they are ignored and logged.",
  "type": "object",
  "additionalProperties": false,
  "properties": {
    "$schema": {
      "type": "string",
      "description": "Points editors at this schema: ./auto-handoff.schema.json."
    },
    "enabled": {
      "type": ["boolean", "null"],
      "default": true,
      "x-env": "AI_DLC_AUTO_HANDOFF_ENABLED",
      "description": "false turns automatic handoffs off. Claude Code's own DISABLE_AUTO_COMPACT also turns them off."
    },
    "thresholdPercent": {
      "type": ["integer", "null"],
      "minimum": 1,
      "maximum": 100,
      "default": 80,
      "x-env": "AI_DLC_AUTO_HANDOFF_THRESHOLD_PERCENT",
      "x-userConfig": "thresholdPercent",
      "description": "Share of the context window, 1 to 100, at which the main session hands off. The window is the one Claude Code reports, else defaultContextWindow. thresholdTokens, when set, replaces it."
    },
    "thresholdTokens": {
      "type": ["integer", "null"],
      "minimum": 1,
      "default": null,
      "x-env": "AI_DLC_AUTO_HANDOFF_THRESHOLD_TOKENS",
      "description": "An absolute handoff line in tokens, replacing thresholdPercent. Use it when Claude Code reports no window and yours is smaller than the percentage line, or for a test run. Unset by default."
    },
    "defaultContextWindow": {
      "type": ["integer", "null"],
      "minimum": 1,
      "default": 500000,
      "x-env": "AI_DLC_AUTO_HANDOFF_DEFAULT_CONTEXT_WINDOW",
      "description": "The context window in tokens that thresholdPercent applies to, used only when Claude Code reports none. 500000 matches neither documented Claude Code window (200000, or 1000000 with extended context): set your real window here, or thresholdTokens. See the ai-dlc README, The fallback window."
    },
    "seedHeadroomTokens": {
      "type": ["integer", "null"],
      "minimum": 0,
      "default": 40000,
      "x-env": "AI_DLC_AUTO_HANDOFF_SEED_HEADROOM_TOKENS",
      "description": "A seeded session hands off no sooner than this many tokens above its own starting size, so it can read its handoff and still do work."
    },
    "maxConsecutiveHandoffs": {
      "type": ["integer", "null"],
      "minimum": 1,
      "default": 2,
      "x-env": "AI_DLC_AUTO_HANDOFF_MAX_CONSECUTIVE",
      "x-userConfig": "maxConsecutiveHandoffs",
      "description": "Handoffs allowed in a row before you type a prompt, when no AI-DLC run is active for the chain. With an active run, chainWhileRunActive decides."
    },
    "chainWhileRunActive": {
      "type": ["boolean", "null"],
      "default": true,
      "x-env": "AI_DLC_AUTO_HANDOFF_CHAIN_WHILE_RUN_ACTIVE",
      "description": "true: while the AI-DLC run the chain hands off stays active, the chain goes on past maxConsecutiveHandoffs, and it ends when the run is done, blocked or abandoned. false: maxConsecutiveHandoffs always applies."
    },
    "renameSessions": {
      "type": ["boolean", "null"],
      "default": true,
      "x-env": "AI_DLC_AUTO_HANDOFF_RENAME_SESSIONS",
      "description": "Name the sessions of a chain \"<sessionNamePrefix>: <original name> (Session N)\". The original session is renamed Session 1 with /rename when the running Claude Code has it."
    },
    "sessionNamePrefix": {
      "type": ["string", "null"],
      "minLength": 1,
      "default": "[ai-dlc:auto-handoff]",
      "x-env": "AI_DLC_AUTO_HANDOFF_SESSION_NAME_PREFIX",
      "description": "The prefix of the chain's session names."
    },
    "briefTemplate": {
      "type": ["string", "null"],
      "minLength": 1,
      "default": "~/.claude/auto-handoff/brief.md",
      "x-env": "AI_DLC_AUTO_HANDOFF_BRIEF_TEMPLATE",
      "x-userConfig": "briefTemplate",
      "x-trustGated": true,
      "description": "Markdown file that tells Haiku which sections to write when no AI-DLC run is active (with one, the handoff skill's session handoff template is used). Created with the defaults on first run. From this file it applies only when Claude Code trusts the folder."
    },
    "instructionsTemplate": {
      "type": ["string", "null"],
      "minLength": 1,
      "default": "~/.claude/auto-handoff/instructions.md",
      "x-env": "AI_DLC_AUTO_HANDOFF_INSTRUCTIONS_TEMPLATE",
      "x-userConfig": "instructionsTemplate",
      "x-trustGated": true,
      "description": "Markdown file that tells the fresh session how to read the brief. Created with the defaults on first run. From this file it applies only when Claude Code trusts the folder."
    },
    "ignoreFiles": {
      "type": ["string", "null"],
      "format": "regex",
      "default": "",
      "x-env": "AI_DLC_AUTO_HANDOFF_IGNORE_FILES",
      "x-userConfig": "ignoreFiles",
      "description": "A regular expression: edited files matching it are left out of the brief. \"\" means none."
    },
    "viewer": {
      "type": ["string", "null"],
      "format": "host-port",
      "pattern": "^\\s*([A-Za-z0-9_.-]+:[1-9][0-9]{1,4})?\\s*$",
      "default": "",
      "x-env": "AI_DLC_AUTO_HANDOFF_VIEWER",
      "x-userConfig": "viewer",
      "x-trustGated": true,
      "description": "Where to serve a readable page for each brief, as host:port, the port 10 to 65535; \"tailscale\" as the host means this machine's Tailscale IP. \"\" means no server. From this file it applies only when Claude Code trusts the folder."
    }
  }
}
